{
  "schemaVersion": 1,
  "allocationVersion": "legacy-content-id-v1",
  "source": {
    "repository": "Xpotato1024/xpotato-site",
    "tag": "legacy-pre-vnext-2026-08-28",
    "tagObjectSha": "8503f5a50a5fb3d27a02422da0b50dc66c818b02",
    "commitSha": "927d105713561309fc5e2374396f86646b5aeb2a",
    "inventoryPayloadSha256": "9151be197d9e48a12297d45dfdd2a72a15cf9ce16f143fdc16b60e5345d37493"
  },
  "entries": [
    {
      "legacyContentId": "blog:2025-10-06",
      "legacyPath": "src/content/blog/2025-10-06.mdx",
      "collection": "blog",
      "targetPath": "apps/site/src/content/blog/2025-10-06.mdx",
      "vNextContentId": "f202daa7-cb5c-4dd3-8b17-7bb6b1feefae",
      "disposition": "migrate"
    },
    {
      "legacyContentId": "blog:anythingllm-fresh-thread-reembed-workspace",
      "legacyPath": "src/content/blog/anythingllm-fresh-thread-reembed-workspace.mdx",
      "collection": "blog",
      "targetPath": "apps/site/src/content/blog/anythingllm-fresh-thread-reembed-workspace.mdx",
      "vNextContentId": "4ccd039f-2625-4f2b-83bb-fe248906ef96",
      "disposition": "migrate"
    },
    {
      "legacyContentId": "blog:anythingllm-vllm-followup-streaming-workaround",
      "legacyPath": "src/content/blog/anythingllm-vllm-followup-streaming-workaround.mdx",
      "collection": "blog",
      "targetPath": "apps/site/src/content/blog/anythingllm-vllm-followup-streaming-workaround.mdx",
      "vNextContentId": "debd5571-6924-42db-a4a6-4e9a748cf0e6",
      "disposition": "migrate"
    },
    {
      "legacyContentId": "blog:codex-sqlite-write-amplification-mitigation",
      "legacyPath": "src/content/blog/codex-sqlite-write-amplification-mitigation.mdx",
      "collection": "blog",
      "targetPath": "apps/site/src/content/blog/codex-sqlite-write-amplification-mitigation.mdx",
      "vNextContentId": "d422c494-da2b-4826-b3c3-5f154e67ac09",
      "disposition": "migrate"
    },
    {
      "legacyContentId": "blog:compacting-wsl-vhd-in-place-after-c-drive-move",
      "legacyPath": "src/content/blog/compacting-wsl-vhd-in-place-after-c-drive-move.mdx",
      "collection": "blog",
      "targetPath": "apps/site/src/content/blog/compacting-wsl-vhd-in-place-after-c-drive-move.mdx",
      "vNextContentId": "3d9d467f-c8a6-4c52-8bfb-ae47135bcd79",
      "disposition": "migrate"
    },
    {
      "legacyContentId": "blog:gale-adaptive-conservative-planner",
      "legacyPath": "src/content/blog/gale-adaptive-conservative-planner.mdx",
      "collection": "blog",
      "targetPath": "apps/site/src/content/blog/gale-adaptive-conservative-planner.mdx",
      "vNextContentId": "4b33bb9d-e1ef-4b7a-9f8b-2b5e51a60289",
      "disposition": "migrate"
    },
    {
      "legacyContentId": "blog:gale-adaptive-multi-run-review",
      "legacyPath": "src/content/blog/gale-adaptive-multi-run-review.mdx",
      "collection": "blog",
      "targetPath": "apps/site/src/content/blog/gale-adaptive-multi-run-review.mdx",
      "vNextContentId": "0087f8b0-fef8-4e96-b24a-3602109ffb7d",
      "disposition": "migrate"
    },
    {
      "legacyContentId": "blog:gale-adaptive-planner-gpu-query-eligibility",
      "legacyPath": "src/content/blog/gale-adaptive-planner-gpu-query-eligibility.mdx",
      "collection": "blog",
      "targetPath": "apps/site/src/content/blog/gale-adaptive-planner-gpu-query-eligibility.mdx",
      "vNextContentId": "f990d2d3-31d8-4bf3-b6b6-fc8873da57ad",
      "disposition": "migrate"
    },
    {
      "legacyContentId": "blog:gale-adaptive-review-checklist",
      "legacyPath": "src/content/blog/gale-adaptive-review-checklist.mdx",
      "collection": "blog",
      "targetPath": "apps/site/src/content/blog/gale-adaptive-review-checklist.mdx",
      "vNextContentId": "47941e0e-dac5-480f-abbb-fcacf4885e41",
      "disposition": "migrate"
    },
    {
      "legacyContentId": "blog:gale-adaptive-rule-governance",
      "legacyPath": "src/content/blog/gale-adaptive-rule-governance.mdx",
      "collection": "blog",
      "targetPath": "apps/site/src/content/blog/gale-adaptive-rule-governance.mdx",
      "vNextContentId": "3e39f5ce-d5e0-4426-9961-b2ed27281d8d",
      "disposition": "migrate"
    },
    {
      "legacyContentId": "blog:gale-adaptive-rule-promotion-gate",
      "legacyPath": "src/content/blog/gale-adaptive-rule-promotion-gate.mdx",
      "collection": "blog",
      "targetPath": "apps/site/src/content/blog/gale-adaptive-rule-promotion-gate.mdx",
      "vNextContentId": "71f85045-1255-405f-bb3e-6243752eb134",
      "disposition": "migrate"
    },
    {
      "legacyContentId": "blog:gale-adaptive-rule-table",
      "legacyPath": "src/content/blog/gale-adaptive-rule-table.mdx",
      "collection": "blog",
      "targetPath": "apps/site/src/content/blog/gale-adaptive-rule-table.mdx",
      "vNextContentId": "d31b62cb-f433-4b10-a275-107299df06cd",
      "disposition": "migrate"
    },
    {
      "legacyContentId": "blog:gale-adaptive-shadow-evaluation",
      "legacyPath": "src/content/blog/gale-adaptive-shadow-evaluation.mdx",
      "collection": "blog",
      "targetPath": "apps/site/src/content/blog/gale-adaptive-shadow-evaluation.mdx",
      "vNextContentId": "7b293cd3-ec3c-4b31-a3ce-93e75bac6409",
      "disposition": "migrate"
    },
    {
      "legacyContentId": "blog:gale-cli-distribution-roadmap-package-managers",
      "legacyPath": "src/content/blog/gale-cli-distribution-roadmap-package-managers.mdx",
      "collection": "blog",
      "targetPath": "apps/site/src/content/blog/gale-cli-distribution-roadmap-package-managers.mdx",
      "vNextContentId": "713150dc-c2b7-4da4-a5d3-f746efe444b2",
      "disposition": "migrate"
    },
    {
      "legacyContentId": "blog:gale-cpu-gpu-acceleration-paths",
      "legacyPath": "src/content/blog/gale-cpu-gpu-acceleration-paths.mdx",
      "collection": "blog",
      "targetPath": "apps/site/src/content/blog/gale-cpu-gpu-acceleration-paths.mdx",
      "vNextContentId": "1f1bbc19-979c-4ccf-b1c0-98d35bb46bbc",
      "disposition": "migrate"
    },
    {
      "legacyContentId": "blog:gale-cpu-index-build-parallel",
      "legacyPath": "src/content/blog/gale-cpu-index-build-parallel.mdx",
      "collection": "blog",
      "targetPath": "apps/site/src/content/blog/gale-cpu-index-build-parallel.mdx",
      "vNextContentId": "62ac5b3b-945e-4cc7-8601-944d4355714d",
      "disposition": "migrate"
    },
    {
      "legacyContentId": "blog:gale-gpu-buffer-reuse",
      "legacyPath": "src/content/blog/gale-gpu-buffer-reuse.mdx",
      "collection": "blog",
      "targetPath": "apps/site/src/content/blog/gale-gpu-buffer-reuse.mdx",
      "vNextContentId": "f1067954-4620-49d7-be4d-8e99229e67a5",
      "disposition": "migrate"
    },
    {
      "legacyContentId": "blog:gale-gpu-chunked-selection-benchmark",
      "legacyPath": "src/content/blog/gale-gpu-chunked-selection-benchmark.mdx",
      "collection": "blog",
      "targetPath": "apps/site/src/content/blog/gale-gpu-chunked-selection-benchmark.mdx",
      "vNextContentId": "b1eeadb5-4b11-4d66-b0c5-b6c8fb18063b",
      "disposition": "migrate"
    },
    {
      "legacyContentId": "blog:gale-gpu-exact-hit-compaction",
      "legacyPath": "src/content/blog/gale-gpu-exact-hit-compaction.mdx",
      "collection": "blog",
      "targetPath": "apps/site/src/content/blog/gale-gpu-exact-hit-compaction.mdx",
      "vNextContentId": "1b377d7f-7e1d-43f8-a350-054d18170a7f",
      "disposition": "migrate"
    },
    {
      "legacyContentId": "blog:gale-gpu-group-aware-ranking",
      "legacyPath": "src/content/blog/gale-gpu-group-aware-ranking.mdx",
      "collection": "blog",
      "targetPath": "apps/site/src/content/blog/gale-gpu-group-aware-ranking.mdx",
      "vNextContentId": "37d289ce-68bf-43cf-8277-6af71fec76d7",
      "disposition": "migrate"
    },
    {
      "legacyContentId": "blog:gale-gpu-host-copy-reduction",
      "legacyPath": "src/content/blog/gale-gpu-host-copy-reduction.mdx",
      "collection": "blog",
      "targetPath": "apps/site/src/content/blog/gale-gpu-host-copy-reduction.mdx",
      "vNextContentId": "43ed6beb-af40-48c0-a963-3ac6ae699a04",
      "disposition": "migrate"
    },
    {
      "legacyContentId": "blog:gale-gpu-on-device-upload-cache",
      "legacyPath": "src/content/blog/gale-gpu-on-device-upload-cache.mdx",
      "collection": "blog",
      "targetPath": "apps/site/src/content/blog/gale-gpu-on-device-upload-cache.mdx",
      "vNextContentId": "514b0edb-3f04-4d11-b49d-9503d567640d",
      "disposition": "migrate"
    },
    {
      "legacyContentId": "blog:gale-gpu-partial-readback",
      "legacyPath": "src/content/blog/gale-gpu-partial-readback.mdx",
      "collection": "blog",
      "targetPath": "apps/site/src/content/blog/gale-gpu-partial-readback.mdx",
      "vNextContentId": "f5c1b418-38de-4dd0-bca2-14ee2c86daee",
      "disposition": "migrate"
    },
    {
      "legacyContentId": "blog:gale-gpu-partial-readback-benchmark",
      "legacyPath": "src/content/blog/gale-gpu-partial-readback-benchmark.mdx",
      "collection": "blog",
      "targetPath": "apps/site/src/content/blog/gale-gpu-partial-readback-benchmark.mdx",
      "vNextContentId": "dfc0776e-87bf-4c6b-91c1-05e02cc1d884",
      "disposition": "migrate"
    },
    {
      "legacyContentId": "blog:gale-gpu-partial-readback-stage-breakdown",
      "legacyPath": "src/content/blog/gale-gpu-partial-readback-stage-breakdown.mdx",
      "collection": "blog",
      "targetPath": "apps/site/src/content/blog/gale-gpu-partial-readback-stage-breakdown.mdx",
      "vNextContentId": "ae5a86bc-9ace-49ed-86a3-4a763993fc0a",
      "disposition": "migrate"
    },
    {
      "legacyContentId": "blog:gale-gpu-pipeline-cache",
      "legacyPath": "src/content/blog/gale-gpu-pipeline-cache.mdx",
      "collection": "blog",
      "targetPath": "apps/site/src/content/blog/gale-gpu-pipeline-cache.mdx",
      "vNextContentId": "1d996b49-964f-49f4-a3e4-6fa26d4c977e",
      "disposition": "migrate"
    },
    {